{
 "about": "The re-import (WP-5.3) by m3a-import 1: each clip's choice between its re-import and its migrated version, with why; both fits (mean, worst mm against the source); both QA verdicts; the sensor metrics that moved ([migrated, re-import]); the hands' mean error against the capture ([migrated, re-import] mm; props: over the clips that hold something); what the catalog skips; the clips the migrated set had that are gone.",
 "mean": 8.1,
 "props": null,
 "clips": {
  "Aeroplane_SideLeft": {
   "kept": "new",
   "why": "new in the re-import",
   "fit": {
    "import": [
     10,
     49
    ]
   },
   "qa": {
    "import": "pass"
   },
   "hands": [
    8.7
   ]
  },
  "Aeroplane_SideRight": {
   "kept": "new",
   "why": "new in the re-import",
   "fit": {
    "import": [
     10,
     41
    ]
   },
   "qa": {
    "import": "pass"
   },
   "hands": [
    7.8
   ]
  },
  "Akimbo_SideLeft": {
   "kept": "new",
   "why": "new in the re-import",
   "fit": {
    "import": [
     7,
     108
    ]
   },
   "qa": {
    "import": "pass"
   },
   "hands": [
    3.8
   ]
  },
  "Akimbo_SideRight": {
   "kept": "new",
   "why": "new in the re-import",
   "fit": {
    "import": [
     7,
     31
    ]
   },
   "qa": {
    "import": "pass"
   },
   "hands": [
    3.7
   ]
  },
  "Angry_SideLeft": {
   "kept": "new",
   "why": "new in the re-import",
   "fit": {
    "import": [
     8,
     87
    ]
   },
   "qa": {
    "import": "warn"
   },
   "hands": [
    10.9
   ],
   "unrepaired": "no step makes it better"
  },
  "Angry_SideRight": {
   "kept": "new",
   "why": "new in the re-import",
   "fit": {
    "import": [
     8,
     58
    ]
   },
   "qa": {
    "import": "warn"
   },
   "hands": [
    9.9
   ],
   "unrepaired": "no step makes it better"
  },
  "ArmsAboveHead_SideLeft": {
   "kept": "new",
   "why": "new in the re-import",
   "fit": {
    "import": [
     7,
     27
    ]
   },
   "qa": {
    "import": "pass"
   },
   "hands": [
    5
   ]
  },
  "ArmsAboveHead_SideRight": {
   "kept": "new",
   "why": "new in the re-import",
   "fit": {
    "import": [
     6,
     39
    ]
   },
   "qa": {
    "import": "pass"
   },
   "hands": [
    5.4
   ]
  },
  "ArmsBehindBack_SideLeft": {
   "kept": "new",
   "why": "new in the re-import",
   "fit": {
    "import": [
     8,
     38
    ]
   },
   "qa": {
    "import": "pass"
   },
   "hands": [
    6.3
   ]
  },
  "ArmsBehindBack_SideRight": {
   "kept": "new",
   "why": "new in the re-import",
   "fit": {
    "import": [
     7,
     32
    ]
   },
   "qa": {
    "import": "pass"
   },
   "hands": [
    4.8
   ]
  },
  "ArmsBySide_SideLeft": {
   "kept": "new",
   "why": "new in the re-import",
   "fit": {
    "import": [
     8,
     38
    ]
   },
   "qa": {
    "import": "pass"
   },
   "hands": [
    7.4
   ]
  },
  "ArmsBySide_SideRight": {
   "kept": "new",
   "why": "new in the re-import",
   "fit": {
    "import": [
     7,
     44
    ]
   },
   "qa": {
    "import": "pass"
   },
   "hands": [
    5.9
   ]
  },
  "ArmsFolded_SideLeft": {
   "kept": "new",
   "why": "new in the re-import",
   "fit": {
    "import": [
     6,
     43
    ]
   },
   "qa": {
    "import": "pass"
   },
   "hands": [
    4.4
   ]
  },
  "ArmsFolded_SideRight": {
   "kept": "new",
   "why": "new in the re-import",
   "fit": {
    "import": [
     6,
     23
    ]
   },
   "qa": {
    "import": "pass"
   },
   "hands": [
    4.3
   ]
  },
  "Balance_SideLeft": {
   "kept": "new",
   "why": "new in the re-import",
   "fit": {
    "import": [
     9,
     42
    ]
   },
   "qa": {
    "import": "pass"
   },
   "hands": [
    8.5
   ]
  },
  "Balance_SideRight": {
   "kept": "new",
   "why": "new in the re-import",
   "fit": {
    "import": [
     10,
     58
    ]
   },
   "qa": {
    "import": "pass"
   },
   "hands": [
    10.7
   ]
  },
  "BeatChest_SideLeft": {
   "kept": "new",
   "why": "new in the re-import",
   "fit": {
    "import": [
     7,
     37
    ]
   },
   "qa": {
    "import": "pass"
   },
   "hands": [
    7.6
   ]
  },
  "BeatChest_SideRight": {
   "kept": "new",
   "why": "new in the re-import",
   "fit": {
    "import": [
     6,
     23
    ]
   },
   "qa": {
    "import": "pass"
   },
   "hands": [
    5.4
   ]
  },
  "BentForward_SideLeft": {
   "kept": "new",
   "why": "new in the re-import",
   "fit": {
    "import": [
     7,
     32
    ]
   },
   "qa": {
    "import": "pass"
   },
   "hands": [
    6.4
   ]
  },
  "BentForward_SideRight": {
   "kept": "new",
   "why": "new in the re-import",
   "fit": {
    "import": [
     6,
     30
    ]
   },
   "qa": {
    "import": "pass"
   },
   "hands": [
    4.4
   ]
  },
  "BentKnees_SideLeft": {
   "kept": "new",
   "why": "new in the re-import",
   "fit": {
    "import": [
     10,
     39
    ]
   },
   "qa": {
    "import": "pass"
   },
   "hands": [
    9.4
   ]
  },
  "BentKnees_SideRight": {
   "kept": "new",
   "why": "new in the re-import",
   "fit": {
    "import": [
     12,
     37
    ]
   },
   "qa": {
    "import": "pass"
   },
   "hands": [
    7.9
   ]
  },
  "BigSteps_SideLeft": {
   "kept": "new",
   "why": "new in the re-import",
   "fit": {
    "import": [
     11,
     50
    ]
   },
   "qa": {
    "import": "pass"
   },
   "hands": [
    10
   ]
  },
  "BigSteps_SideRight": {
   "kept": "new",
   "why": "new in the re-import",
   "fit": {
    "import": [
     10,
     64
    ]
   },
   "qa": {
    "import": "pass"
   },
   "hands": [
    9.4
   ]
  },
  "BouncyLeft_SideLeft": {
   "kept": "new",
   "why": "new in the re-import",
   "fit": {
    "import": [
     9,
     52
    ]
   },
   "qa": {
    "import": "pass"
   },
   "hands": [
    6.5
   ]
  },
  "BouncyLeft_SideRight": {
   "kept": "new",
   "why": "new in the re-import",
   "fit": {
    "import": [
     8,
     39
    ]
   },
   "qa": {
    "import": "pass"
   },
   "hands": [
    6
   ]
  },
  "BouncyRight_SideLeft": {
   "kept": "new",
   "why": "new in the re-import",
   "fit": {
    "import": [
     8,
     33
    ]
   },
   "qa": {
    "import": "pass"
   },
   "hands": [
    7
   ]
  },
  "BouncyRight_SideRight": {
   "kept": "new",
   "why": "new in the re-import",
   "fit": {
    "import": [
     9,
     79
    ]
   },
   "qa": {
    "import": "pass"
   },
   "hands": [
    8.5
   ]
  },
  "Cat_SideLeft": {
   "kept": "new",
   "why": "new in the re-import",
   "fit": {
    "import": [
     6,
     24
    ]
   },
   "qa": {
    "import": "pass"
   },
   "hands": [
    7.1
   ]
  },
  "Cat_SideRight": {
   "kept": "new",
   "why": "new in the re-import",
   "fit": {
    "import": [
     8,
     43
    ]
   },
   "qa": {
    "import": "pass"
   },
   "hands": [
    6.9
   ]
  },
  "Chicken_SideLeft": {
   "kept": "new",
   "why": "new in the re-import",
   "fit": {
    "import": [
     8,
     40
    ]
   },
   "qa": {
    "import": "pass"
   },
   "hands": [
    8.2
   ]
  },
  "Chicken_SideRight": {
   "kept": "new",
   "why": "new in the re-import",
   "fit": {
    "import": [
     6,
     34
    ]
   },
   "qa": {
    "import": "pass"
   },
   "hands": [
    5.2
   ]
  },
  "CrossOver_SideLeft": {
   "kept": "new",
   "why": "new in the re-import",
   "fit": {
    "import": [
     9,
     58
    ]
   },
   "qa": {
    "import": "pass"
   },
   "hands": [
    7.9
   ]
  },
  "CrossOver_SideRight": {
   "kept": "new",
   "why": "new in the re-import",
   "fit": {
    "import": [
     7,
     39
    ]
   },
   "qa": {
    "import": "pass"
   },
   "hands": [
    7.5
   ]
  },
  "Crouched_SideLeft": {
   "kept": "new",
   "why": "new in the re-import",
   "fit": {
    "import": [
     9,
     33
    ]
   },
   "qa": {
    "import": "pass"
   },
   "hands": [
    6.2
   ]
  },
  "Crouched_SideRight": {
   "kept": "new",
   "why": "new in the re-import",
   "fit": {
    "import": [
     9,
     31
    ]
   },
   "qa": {
    "import": "pass"
   },
   "hands": [
    7.2
   ]
  },
  "CrowdAvoidance_SideLeft": {
   "kept": "new",
   "why": "new in the re-import",
   "fit": {
    "import": [
     6,
     38
    ]
   },
   "qa": {
    "import": "pass"
   },
   "hands": [
    5
   ]
  },
  "CrowdAvoidance_SideRight": {
   "kept": "new",
   "why": "new in the re-import",
   "fit": {
    "import": [
     10,
     36
    ]
   },
   "qa": {
    "import": "pass"
   },
   "hands": [
    6.4
   ]
  },
  "Depressed_SideLeft": {
   "kept": "new",
   "why": "new in the re-import",
   "fit": {
    "import": [
     8,
     33
    ]
   },
   "qa": {
    "import": "pass"
   },
   "hands": [
    9
   ]
  },
  "Depressed_SideRight": {
   "kept": "new",
   "why": "new in the re-import",
   "fit": {
    "import": [
     8,
     51
    ]
   },
   "qa": {
    "import": "pass"
   },
   "hands": [
    9.4
   ]
  },
  "Dinosaur_SideLeft": {
   "kept": "new",
   "why": "new in the re-import",
   "fit": {
    "import": [
     8,
     43
    ]
   },
   "qa": {
    "import": "pass"
   },
   "hands": [
    4.1
   ]
  },
  "Dinosaur_SideRight": {
   "kept": "new",
   "why": "new in the re-import",
   "fit": {
    "import": [
     8,
     42
    ]
   },
   "qa": {
    "import": "pass"
   },
   "hands": [
    4.4
   ]
  },
  "DragLeftLeg_SideRight": {
   "kept": "new",
   "why": "new in the re-import",
   "fit": {
    "import": [
     7,
     27
    ]
   },
   "qa": {
    "import": "pass"
   },
   "hands": [
    6.9
   ]
  },
  "DragRightLeg_SideLeft": {
   "kept": "new",
   "why": "new in the re-import",
   "fit": {
    "import": [
     8,
     28
    ]
   },
   "qa": {
    "import": "pass"
   },
   "hands": [
    6.3
   ]
  },
  "Drunk_SideLeft": {
   "kept": "new",
   "why": "new in the re-import",
   "fit": {
    "import": [
     8,
     54
    ]
   },
   "qa": {
    "import": "pass"
   },
   "hands": [
    9.1
   ]
  },
  "Drunk_SideRight": {
   "kept": "new",
   "why": "new in the re-import",
   "fit": {
    "import": [
     8,
     49
    ]
   },
   "qa": {
    "import": "pass"
   },
   "hands": [
    8.2
   ]
  },
  "DuckFoot_SideLeft": {